id,bookTitle,page,bookID,bookType,anchorText,itemType,date,author,language
111,Le Mot,47,https://derridas-margins.princeton.edu/titles/166/,Journal Article,"Œ‚ŒæCe qu'un linguiste contemporain peut dire du mot illustre bien à quelle révision générale des concepts traditionnels la recherche fonctionnaliste et structuraliste des trente-cinq dernières années a díé procéder afin de donner une base scientifique à l'observation et à la description des langues. Certaines applications de la linguistique, comme les recherches relatives à la traduction mécanique, par l'accent qu'elles mettent sur la forme écrite du langage, pourraient faire croire à l'importance foncière des divisions du texte écrit et faire oublier que c'est de l'énoncé oral qu'il faut toujours partir pour comprendre la nature réelle du langage humain. Aussi est-il, plus que jamais, indispensable d'insister sur la nécessité de pousser l'examen au-delà des apparences immédiates et des structures le plus familières au chercheur. C'est derrière l'écran du mot qu'apparaissent bien souvent les traits réellement fondamentaux du langage humain.ŒæŒé",journalArticle,1965,"Martinet, André",fr
111,Le Mot,101,https://derridas-margins.princeton.edu/titles/166/,Journal Article,Cf. aussi l'article de *Diogène* déjà cité.,journalArticle,1965,"Martinet, André",fr
111,Le Mot,46,https://derridas-margins.princeton.edu/titles/166/,Journal Article,"in *Diogène*, 51, 1965. A. Martinet fait allusion à l'Œ‚ŒæaudaceŒæŒé qu'il Œ‚Œæaurait falluŒæŒé naguère pour Œ‚Œæenvisager d'écarter le terme ""mot"" au cas oí_ la recherche aurait montré qu'il n'y a pas possibilité de donner de ce terme une définition universellement applicableŒæŒé. (p. 39) äó_ Œ‚ŒæLa sémiologie, telle que de récentes études le laissent entrevoir, n'a aucun besoin du mot.ŒæŒé (p. 40) äó_ Œ‚ŒæIl y a longtemps que grammariens et linguistes se sont avisés que l'analyse de l'énoncé pouvait se poursuivre au-delà du mot sans verser pour cela dans la phonétique, c'est-à-dire aboutir à des segments du discours, comme la syllabe ou le phonème, qui n'ont plus rien à faire avec le sens.ŒæŒé (p. 41). Œ‚ŒæNous touchons là à ce qui rend la notion de mot si suspecte à tout véritable linguisteŒæ: il ne saurait íÈtre question pour lui d'accepter les graphies traditionnelles sans vérifier, au préalable, si elles reproduisent fidèlement la structure véritable de la langue qu'elles sont censées noter.ŒæŒé (p. 48). A. Martinet propose pour conclure de remplacer, Œ‚Œædans la pratique linguistiqueŒæŒé, la notion de mot par celle de Œ‚ŒæsyntagmeŒæŒé, Œ‚Œægroupe de plusieurs signes minimaŒæŒé qu'on appellera Œ‚ŒæmonèmesŒæŒé.",journalArticle,1965,"Martinet, André",fr
111,Le Mot,46,https://derridas-margins.princeton.edu/titles/166/,Journal Article,"in *Diogène*, 51, 1965. A. Martinet fait allusion à l'Œ‚ŒæaudaceŒæŒé qu'il Œ‚Œæaurait falluŒæŒé naguère pour Œ‚Œæenvisager d'écarter le terme ""mot"" au cas oí_ la recherche aurait montré qu'il n'y a pas possibilité de donner de ce terme une définition universellement applicableŒæŒé. (p. 39) äó_ Œ‚ŒæLa sémiologie, telle que de récentes études le laissent entrevoir, n'a aucun besoin du mot.ŒæŒé (p. 40) äó_ Œ‚ŒæIl y a longtemps que grammariens et linguistes se sont avisés que l'analyse de l'énoncé pouvait se poursuivre au-delà du mot sans verser pour cela dans la phonétique, c'est-à-dire aboutir à des segments du discours, comme la syllabe ou le phonème, qui n'ont plus rien à faire avec le sens.ŒæŒé (p. 41). Œ‚ŒæNous touchons là à ce qui rend la notion de mot si suspecte à tout véritable linguisteŒæ: il ne saurait íÈtre question pour lui d'accepter les graphies traditionnelles sans vérifier, au préalable, si elles reproduisent fidèlement la structure véritable de la langue qu'elles sont censées noter.ŒæŒé (p. 48). A. Martinet propose pour conclure de remplacer, Œ‚Œædans la pratique linguistiqueŒæŒé, la notion de mot par celle de Œ‚ŒæsyntagmeŒæŒé, Œ‚Œægroupe de plusieurs signes minimaŒæŒé qu'on appellera Œ‚ŒæmonèmesŒæŒé.",journalArticle,1965,"Martinet, André",fr
111,Le Mot,46,https://derridas-margins.princeton.edu/titles/166/,Journal Article,"in *Diogène*, 51, 1965. A. Martinet fait allusion à l'Œ‚ŒæaudaceŒæŒé qu'il Œ‚Œæaurait falluŒæŒé naguère pour Œ‚Œæenvisager d'écarter le terme ""mot"" au cas oí_ la recherche aurait montré qu'il n'y a pas possibilité de donner de ce terme une définition universellement applicableŒæŒé. (p. 39) äó_ Œ‚ŒæLa sémiologie, telle que de récentes études le laissent entrevoir, n'a aucun besoin du mot.ŒæŒé (p. 40) äó_ Œ‚ŒæIl y a longtemps que grammariens et linguistes se sont avisés que l'analyse de l'énoncé pouvait se poursuivre au-delà du mot sans verser pour cela dans la phonétique, c'est-à-dire aboutir à des segments du discours, comme la syllabe ou le phonème, qui n'ont plus rien à faire avec le sens.ŒæŒé (p. 41). Œ‚ŒæNous touchons là à ce qui rend la notion de mot si suspecte à tout véritable linguisteŒæ: il ne saurait íÈtre question pour lui d'accepter les graphies traditionnelles sans vérifier, au préalable, si elles reproduisent fidèlement la structure véritable de la langue qu'elles sont censées noter.ŒæŒé (p. 48). A. Martinet propose pour conclure de remplacer, Œ‚Œædans la pratique linguistiqueŒæŒé, la notion de mot par celle de Œ‚ŒæsyntagmeŒæŒé, Œ‚Œægroupe de plusieurs signes minimaŒæŒé qu'on appellera Œ‚ŒæmonèmesŒæŒé.",journalArticle,1965,"Martinet, André",fr
111,Le Mot,46,https://derridas-margins.princeton.edu/titles/166/,Journal Article,"in *Diogène*, 51, 1965. A. Martinet fait allusion à l'Œ‚ŒæaudaceŒæŒé qu'il Œ‚Œæaurait falluŒæŒé naguère pour Œ‚Œæenvisager d'écarter le terme ""mot"" au cas oí_ la recherche aurait montré qu'il n'y a pas possibilité de donner de ce terme une définition universellement applicableŒæŒé. (p. 39) äó_ Œ‚ŒæLa sémiologie, telle que de récentes études le laissent entrevoir, n'a aucun besoin du mot.ŒæŒé (p. 40) äó_ Œ‚ŒæIl y a longtemps que grammariens et linguistes se sont avisés que l'analyse de l'énoncé pouvait se poursuivre au-delà du mot sans verser pour cela dans la phonétique, c'est-à-dire aboutir à des segments du discours, comme la syllabe ou le phonème, qui n'ont plus rien à faire avec le sens.ŒæŒé (p. 41). Œ‚ŒæNous touchons là à ce qui rend la notion de mot si suspecte à tout véritable linguisteŒæ: il ne saurait íÈtre question pour lui d'accepter les graphies traditionnelles sans vérifier, au préalable, si elles reproduisent fidèlement la structure véritable de la langue qu'elles sont censées noter.ŒæŒé (p. 48). A. Martinet propose pour conclure de remplacer, Œ‚Œædans la pratique linguistiqueŒæŒé, la notion de mot par celle de Œ‚ŒæsyntagmeŒæŒé, Œ‚Œægroupe de plusieurs signes minimaŒæŒé qu'on appellera Œ‚ŒæmonèmesŒæŒé.",journalArticle,1965,"Martinet, André",fr
112,Le Petit,210,https://derridas-margins.princeton.edu/titles/160/,Book,"Collage ici de cette phrase de G. BatailleŒæ:ŒæŒ‚ŒæJe suis moi-míÈme le Œ‚ŒæpetitŒæŒé, je n'ai de place que caché.ŒæŒé (*Le petit*).",book,1943,"Bataille, Georges",fr
113,Le Principe de raison,71,https://derridas-margins.princeton.edu/titles/15/,Book,"C'est bien évidemment à Nietzsche que nous renvoient encore ces thèmes présents dans la pensée de Heidegger (cf. *La chose*, 1950, tr. fr. in *Essais et conférences*, p. 214 sq. *Le principe de raison*, 1955-1956, tr. fr. p. 240 sq.), de Fink (*Le jeu comme symbole du monde*, 1960) et, en France, de K. Axelos (*Vers la pensée planétaire*, 1964 et *Einfí_hrung ein ein kí_nftiges Denken*, 1966).",book,1962,"Heidegger, Martin",fr
114,Le problème de l'être chez Aristote,22,https://derridas-margins.princeton.edu/titles/6/,Book,"C'est ce que montre Pierre Aubenque (*Le problème de l'íÈtre chez Aristote*, p. 106 sq.). Au cours d'une remarquable analyse, dont nous nous inspirons ici, P. Aubenque note en effetŒæ: Œ‚ŒæDans d'autres textes, il est vrai, Aristote qualifie de symbole le rapport du langage aux chosesŒæ: ""Il n'est pas possible d'apporter dans la discussion les choses elles-míÈmes, mais, au lieu des choses, nous devons nous servir de leurs noms comme de symboles."" L'intermédiaire que constituait l'état d'í¢me et ici supprimé ou du moins négligé, mais cette suppression est légitime, puisque les états d'í¢me se comportant comme les choses, celles-ci peuvent leur íÈtre immédiatement substituées. En revanche, on ne peut pas substituer, sans plus, le nom à la choseŒæäó_ŒæŒé (p. 107-108).",book,1962,"Aubenque, Pierre",fr
114,Le problème de l'être chez Aristote,22,https://derridas-margins.princeton.edu/titles/6/,Book,"C'est ce que montre Pierre Aubenque (*Le problème de l'íÈtre chez Aristote*, p. 106 sq.). Au cours d'une remarquable analyse, dont nous nous inspirons ici, P. Aubenque note en effetŒæ: Œ‚ŒæDans d'autres textes, il est vrai, Aristote qualifie de symbole le rapport du langage aux chosesŒæ: ""Il n'est pas possible d'apporter dans la discussion les choses elles-míÈmes, mais, au lieu des choses, nous devons nous servir de leurs noms comme de symboles."" L'intermédiaire que constituait l'état d'í¢me et ici supprimé ou du moins négligé, mais cette suppression est légitime, puisque les états d'í¢me se comportant comme les choses, celles-ci peuvent leur íÈtre immédiatement substituées. En revanche, on ne peut pas substituer, sans plus, le nom à la choseŒæäó_ŒæŒé (p. 107-108).",book,1962,"Aubenque, Pierre",fr
115,Le Rationalisme de J.-J. Rousseau,250,https://derridas-margins.princeton.edu/titles/120/,Book,"Bien que les choses soient fort complexes quand il s'agit de la raison selon Rousseau,",book,1948,"Derathé, Robert",fr
115,Le Rationalisme de J.-J. Rousseau,235,https://derridas-margins.princeton.edu/titles/120/,Book,"C'est aussi l'avis de R. Derathé, du moins en ce qui concerne les chapitres IX et X qui sont parmi les plus importants et qui,
expliquant la Œ‚ŒæFormation des langues méridionalesŒæŒé et la Œ‚ŒæFormation des langues du nordŒæŒé, développent des thèmes
fort apparentés à ceux du second *Discours*.",book,1948,"Derathé, Robert",fr
115,Le Rationalisme de J.-J. Rousseau,240,https://derridas-margins.princeton.edu/titles/120/,Book,"Nous nous demandons si l'on peut sur ce point opposer, comme le fait R. Derathé, la doctrine de *l'Emile* et celle du second *Discours* (Œ‚Œæ...dans *l'Emile* la pitié devient un sentiment dérivé de l'amour de soi alors que le second *Discours* opposait ces deux principes l'un à l'autre...ŒæŒé *Le rationalisme de J.-J. Rousseau*, pp. 99-100).",book,1948,"Derathé, Robert",fr
115,Le Rationalisme de J.-J. Rousseau,237,https://derridas-margins.princeton.edu/titles/120/,Book,"Que *l'Essai* soit une pièce destinée au second *Discours*, c'est là, selon Derathé, l'hypothèse Œ‚Œæla plus vraisemblable, du moins en ce qui concerne les chapitres IX et X... qui témoignent des míÈmes préoccupations que le *Discours sur l'inégalité*ŒæŒé.",book,1948,"Derathé, Robert",fr
115,Le Rationalisme de J.-J. Rousseau,253,https://derridas-margins.princeton.edu/titles/120/,Book,"R. Derathé rappelle que Œ‚ŒæDurkheim est... le premier à avoir signalé l'importance de cette notion de faculté virtuelle chez
RousseauŒæŒé. *Le rationalisme de Rousseau*. p. 13. Cf. Durkheim, *Le Contrat social, histoire du livre.* R.M.M. Janv.-fév. 1918. La plupart des contradictions systématiques de Rousseau seraient effacées par l'appel à ce concept de faculté virtuelle qui opère comme une soudure à tous les points de rupture, et d'abord aux points oí_ la société brise äóîŒæet s'articuleŒæäóî avec la nature.",book,1948,"Derathé, Robert",fr
116,Le Robert,202,https://derridas-margins.princeton.edu/titles/3/,Book,"A la différence du *complément*, disent les dictionnaires, le supplément est une Œ‚Œæaddition *extérieure*ŒæŒé (Robert).",NA,1967,"Robert, Paul",fr
117,Le totémisme aujourd'hui,150,https://derridas-margins.princeton.edu/titles/41/,Book,"Œ‚Œæle premier traité d'anthropologie générale que compte la littérature franí_aise. En termes presque modernes, Rousseau y pose le problème central de läó»anthropologie qui est celui du passage de la nature à la cultureŒæŒé (p. 142).",book,1962,"Lévi-Strauss, Claude",fr
117,Le totémisme aujourd'hui,150,https://derridas-margins.princeton.edu/titles/41/,Book,"Rappelons néanmoins, à la fin du *Totémisme aujourd'hui*, ce chapitre sur Œ‚ŒæLe totémisme du dedansŒæŒéŒæ: Œ‚Œæferveur militanteŒæŒé Œ‚Œæenvers l'ethnographieŒæŒé, Œ‚Œæclairvoyance étonnanteŒæŒé de Rousseau qui, Œ‚Œæmieux avisé que BergsonŒæŒé et Œ‚Œæavant míÈme la découverte du totémismeŒæŒé a Œ‚Œæpénétré dans ce qui ouvre la possibilité du totémisme en généralŒæŒé (p. 147), à savoirŒæ:",book,1962,"Lévi-Strauss, Claude",fr
118,Leçon inaugurale,168,https://derridas-margins.princeton.edu/titles/42/,Book,"Qui demandaient à voir et n'auraient sans doute pas compris à quoi on pouvait bien faire allusion sous le nom de l'Œ‚Œæalliance originelle, enfin renouveléeŒæŒé, permettant Œ‚Œæde fonder ensemble le *nous* contre le *lui*ŒæŒé (déjà cité), ou sous le nom de Œ‚Œæcette structure régulière et comme cristalline, dont les mieux préservées des sociétés primitives nous enseignent qu'elle n'est pas contradictoire à l'humanité Œé (*Leí_on inaugurale au Collège de France*).",NA,1960,"Lévi-Strauss, Claude",fr
119,Leçons sur la philosophie de la religion,39,https://derridas-margins.princeton.edu/titles/71/,Book,"*dem Statarischen*, mot de vieil allemand qu'on avait été tenté de traduire jusqu'ici par Œ‚ŒæimmobileŒæŒé, Œ‚ŒæstatiqueŒæŒé (cf. Gibelin, pp. 255-257).",book,1832,"Hegel, Georg Wilhelm Friedrich",fr
120,Leibniz,114,https://derridas-margins.princeton.edu/titles/32/,Book,"Sur tous ces problèmes cf. aussi R.F. Merkel, *Leibniz und China*, in *Leibniz zu seinem 300 Geburtstag*, 1952. Sur les lettres échangées au sujet de la pensée et de l'écriture chinoises avec le P. Bouvet, cf. p. 18-20 et Baruzi, *Leibniz*, 1909, p. 156-165.",book,1909,"Baruzi, Jean",fr
121,Leibniz critique de Descartes,112,https://derridas-margins.princeton.edu/titles/118/,Book,"L'analytisme de Descartes est intuitionniste, celui de Leibniz renvoie au-delà de l'évidence, vers l'ordre, la relation, le point de vue.",book,1960,"Belaval, Yvon",fr
121,Leibniz critique de Descartes,112,https://derridas-margins.princeton.edu/titles/118/,Book,"Malgré toutes les différences qui séparent les projets de langue ou d'écriture universelles à cette époque (notamment
quant à l'histoire et au langage), le concept du simple absolu y est toujours nécessairement et indispensablement à l'Åñuvre.",book,1960,"Belaval, Yvon",fr
122,Leibniz und China,114,https://derridas-margins.princeton.edu/titles/31/,Book,"Sur tous ces problèmes cf. aussi R.F. Merkel, *Leibniz und China*, in *Leibniz zu seinem 300 Geburtstag*, 1952. Sur les lettres échangées au sujet de la pensée et de l'écriture chinoises avec le P. Bouvet, cf. p. 18-20 et Baruzi, *Leibniz*, 1909, p. 156-165.",book,1952,"Merkel, Rudolf Franz",de
123,Les anagrammes de Ferdinand de Saussure,101,https://derridas-margins.princeton.edu/titles/210/,Journal Article,"*Mercure de France*, fév. 1964, p. 254. Présentant ce texte, J. Starobinski évoque le modèle musical et conclutŒæ: Œ‚ŒæCette lecture se développe selon un autre *tempo* (et dans un autre temps)Œæ: à la limite, l'on sort du temps de la Œ‚ŒæconsécutivitéŒæŒé propre au langage habituelŒæŒé. On pourrait sans doute dire *propre au concept habituel* du temps et du langage.",journalArticle,1964,"Starobinski, Jean",fr
123,Les anagrammes de Ferdinand de Saussure,101,https://derridas-margins.princeton.edu/titles/210/,Journal Article,"Œ‚ŒæQue les éléments qui forment un mot *se suivent*, c'est là une vérité qu'il vaudrait mieux ne pas considérer, en linguistique, comme une chose sans intéríÈt parce qu'évidente, mais qui donne d'avance au contraire le principe central de toute réflexion utile sur les mots. Dans un domaine infiniment spécial comme celui que nous avons à traiter, c'est
toujours en vertu de la loi fondamentale du mot humain en général que peut se poser une question comme celle de la
consécutivité ou non-consécutivitéŒæŒé.",journalArticle,1964,"Starobinski, Jean",fr
123,Les anagrammes de Ferdinand de Saussure,55,https://derridas-margins.princeton.edu/titles/210/,Journal Article,"L'inversion des rapports naturels aurait ainsi engendré le culte pervers de la lettre-imageŒæ: péché d'idolí¢trie, Œ‚Œæsuperstition pour la lettreŒæŒé dit Saussure dans les *Anagrammes* oí_ il a d'ailleurs du mal à prouver l'existence d'un Œ‚Œæphonème antérieur à toute écritureŒæŒé.",journalArticle,1964,"Starobinski, Jean",fr
124,Les dieux et le destin en Babylonie,107,https://derridas-margins.princeton.edu/titles/121/,Book,"Elle l'a fait en particulier dans *Les dieux et le destin en Babylonie* (P.U.F. 1949)Œæ; (cf, surtout le dernier chapitre sur *Le règne de l'écriture*)",book,1949,"V.-David, Madeleine",fr
125,Les écritures indiennes. Le monde indien et son système graphique.,20,https://derridas-margins.princeton.edu/titles/237/,Book,"Cf. par ex. EP. pp. 126, 148, 355, etc. D'un autre point de vue, cf. Jakobson, *Essais de linguistique générale* (tr. fr. p. 116)",NA,1963,"Filliozat, Jean",fr
125,Les écritures indiennes. Le monde indien et son système graphique.,136,https://derridas-margins.princeton.edu/titles/237/,Book,"Nous ne pouvons naturellement songer à décrire ici la masse infinie du contenu factuel que nous intitulons dans ce paragraphe. íó titre indicatif et préliminaire, nous renvoyons aux travaux suivants qui comportent tous une importante bibliographie : J. Février, M. Granet, M. Cohen, M. V.-David, *op. cit.* Cf. aussi A. Métraux, art. cité, EP, p. 19 (voir l'intervention de G. Dieterlen, p. 19 et de M. Cohen, p. 27) ; J. Gernet, art. cité, pp. 29, 33, 37, 38, 39, 43 ; J. Sainte Fare Garnot, *Les hiéroglyphes, l'évolution des écritures égyptiennes, EP, pp. 57, 68, 70 ; R. Labat, art. cité, pp. 77, 78, 82, 83 ; O. Masson, *La civilisation égéenne, Les écritures crétoises et mycéniennes*, EP, p. 99. E. Laroche, *L'Asie mineure, les Hittites, peuple à double écriture*, EP, pp. 105-111, 113. M. Rodinson, *Les sémites et l'alphabet, Les écritures sud-arabiques et éthiopiennes,* EP, pp. 136 à 145. J. Filliozat, *Les écritures indiennes. Le monde indien et son système graphique,* EP. p. 148. H. Lévy-Bruhl, *L'écriture et le droit*, EP, pp. 325-333. Voir aussi EP, *Confrontations et conclusions*, p. 335 sq.",NA,1963,"Filliozat, Jean",fr
126,Les hiéroglyphes. L'évolution des écritures égyptiennes,136,https://derridas-margins.princeton.edu/titles/234/,Book,"Nous ne pouvons naturellement songer à décrire ici la masse infinie du contenu factuel que nous intitulons dans ce paragraphe. íó titre indicatif et préliminaire, nous renvoyons aux travaux suivants qui comportent tous une importante bibliographie : J. Février, M. Granet, M. Cohen, M. V.-David, *op. cit.* Cf. aussi A. Métraux, art. cité, EP, p. 19 (voir l'intervention de G. Dieterlen, p. 19 et de M. Cohen, p. 27) ; J. Gernet, art. cité, pp. 29, 33, 37, 38, 39, 43 ; J. Sainte Fare Garnot, *Les hiéroglyphes, l'évolution des écritures égyptiennes, EP, pp. 57, 68, 70 ; R. Labat, art. cité, pp. 77, 78, 82, 83 ; O. Masson, *La civilisation égéenne, Les écritures crétoises et mycéniennes*, EP, p. 99. E. Laroche, *L'Asie mineure, les Hittites, peuple à double écriture*, EP, pp. 105-111, 113. M. Rodinson, *Les sémites et l'alphabet, Les écritures sud-arabiques et éthiopiennes,* EP, pp. 136 à 145. J. Filliozat, *Les écritures indiennes. Le monde indien et son système graphique,* EP. p. 148. H. Lévy-Bruhl, *L'écriture et le droit*, EP, pp. 325-333. Voir aussi EP, *Confrontations et conclusions*, p. 335 sq.",bookSection,1963,"Sainte Fare Garnot, Jean",fr
126,Les hiéroglyphes. L'évolution des écritures égyptiennes,136,https://derridas-margins.princeton.edu/titles/234/,Book,"Nous ne pouvons naturellement songer à décrire ici la masse infinie du contenu factuel que nous intitulons dans ce paragraphe. íó titre indicatif et préliminaire, nous renvoyons aux travaux suivants qui comportent tous une importante bibliographie : J. Février, M. Granet, M. Cohen, M. V.-David, *op. cit.* Cf. aussi A. Métraux, art. cité, EP, p. 19 (voir l'intervention de G. Dieterlen, p. 19 et de M. Cohen, p. 27) ; J. Gernet, art. cité, pp. 29, 33, 37, 38, 39, 43 ; J. Sainte Fare Garnot, *Les hiéroglyphes, l'évolution des écritures égyptiennes, EP, pp. 57, 68, 70 ; R. Labat, art. cité, pp. 77, 78, 82, 83 ; O. Masson, *La civilisation égéenne, Les écritures crétoises et mycéniennes*, EP, p. 99. E. Laroche, *L'Asie mineure, les Hittites, peuple à double écriture*, EP, pp. 105-111, 113. M. Rodinson, *Les sémites et l'alphabet, Les écritures sud-arabiques et éthiopiennes,* EP, pp. 136 à 145. J. Filliozat, *Les écritures indiennes. Le monde indien et son système graphique,* EP. p. 148. H. Lévy-Bruhl, *L'écriture et le droit*, EP, pp. 325-333. Voir aussi EP, *Confrontations et conclusions*, p. 335 sq.",bookSection,1963,"Sainte Fare Garnot, Jean",fr
126,Les hiéroglyphes. L'évolution des écritures égyptiennes,136,https://derridas-margins.princeton.edu/titles/234/,Book,"Nous ne pouvons naturellement songer à décrire ici la masse infinie du contenu factuel que nous intitulons dans ce paragraphe. íó titre indicatif et préliminaire, nous renvoyons aux travaux suivants qui comportent tous une importante bibliographie : J. Février, M. Granet, M. Cohen, M. V.-David, *op. cit.* Cf. aussi A. Métraux, art. cité, EP, p. 19 (voir l'intervention de G. Dieterlen, p. 19 et de M. Cohen, p. 27) ; J. Gernet, art. cité, pp. 29, 33, 37, 38, 39, 43 ; J. Sainte Fare Garnot, *Les hiéroglyphes, l'évolution des écritures égyptiennes, EP, pp. 57, 68, 70 ; R. Labat, art. cité, pp. 77, 78, 82, 83 ; O. Masson, *La civilisation égéenne, Les écritures crétoises et mycéniennes*, EP, p. 99. E. Laroche, *L'Asie mineure, les Hittites, peuple à double écriture*, EP, pp. 105-111, 113. M. Rodinson, *Les sémites et l'alphabet, Les écritures sud-arabiques et éthiopiennes,* EP, pp. 136 à 145. J. Filliozat, *Les écritures indiennes. Le monde indien et son système graphique,* EP. p. 148. H. Lévy-Bruhl, *L'écriture et le droit*, EP, pp. 325-333. Voir aussi EP, *Confrontations et conclusions*, p. 335 sq.",bookSection,1963,"Sainte Fare Garnot, Jean",fr
127,Les Primitifs. Signaux et symboles,130,https://derridas-margins.princeton.edu/titles/232/,Book,"A. Métraux, *Les primitifs, signaux et symboles, pictogrammes et protoécriture*. Un exemple, parmi tant d'autres, de ce que Métraux appelle Œ‚Œæébauche de phonétismeŒæŒéŒæ:ŒæŒ‚ŒæAinsi, le chef Cheyenne qui s'appelle Œ‚Œætortue-suivant-sa-femelleŒæŒé sera représenté par un personnage surmonté de deux tortues. Œ‚ŒæPetit-hommeŒæŒé sera identifié à une silhouette d'enfant dessinée au-dessus de sa tíÈte. Cette expression des noms propres ne pose guère de difficultés lorsqu'il s'agit de choses concrètes, mais elle met à dure épreuve l'imagination du scribe s'il lui faut rendre par la pictographie des idées
abstraites. Pour transcrire le nom d'un individu appelé Œ‚Œægrande-routeŒæŒé, un indien Oglagla a eu recours à la combinaison symbolique suivanteŒæ: des traits parallèles avec des traces de pas font songer à la Œ‚ŒærouteŒæŒé, un oiseau peint près de celle-ci évoque la rapidité qui est, évidemment, un des attributs des Œ‚Œæbonnes routesŒæŒé. Il est clair que seuls ceux qui connaissent déjà les noms correspondant à ces symboles sont à míÈme de les déchiffrer. A ce titre, ces dessins auront donc une valeur mnémotechnique. Prenons, comme autre exemple, le nom propre Œ‚ŒæBonne-beletteŒæŒé. De la bouche de l'animal, dessiné de faí_on réaliste, sortent deux traits ondulés qui d'ordinaire symbolisent le flot des paroles. Ce signe
étant utilisé pour les Œ‚Œæbons discoursŒæŒé, on suppose que le lecteur ne retiendra que l'adjectif et oubliera l'idée de discoursŒæŒé, EP, pp. 10-11.",bookSection,1963,"Métraux, Alfred",fr
127,Les Primitifs. Signaux et symboles,131,https://derridas-margins.princeton.edu/titles/232/,Book,"Œ‚ŒæAinsi, le nom propre *Téocaltitlan* est-il décomposé en plusieurs syllabes qui sont rendues par les images suivantesŒæ:
lèvres (*tentli*), rue (*otlim*), maison (*calli*) et enfin dent (*tlanti*). Le procédé se rattache étroitement à celui... qui consiste à suggérer le nom d'un personnage par les images des íÈtres ou des choses entrant dans la composition de son nom. Les Aztèques sont allés plus avant dans la voie du phonétisme. Ils ont réussi à rendre par des images des sons séparés en recourant à une véritable analyse phonétique.ŒæŒé",bookSection,1963,"Métraux, Alfred",fr
